466,MDU6SXNzdWUxNzk2Njc5MzM=,110,Pretrained model for img2txt?
3730,MDU6SXNzdWUzMDgyNjAwMzU=,98,[deeplab] Training deeplab model with ADE20K dataset
3196,MDU6SXNzdWUyODk3MjY5Njg=,88,[SSD] Small object detection
3387,MDU6SXNzdWUyOTczMDAxNzM=,83,DELF: Training procedure
1591,MDU6SXNzdWUyMzY2MzM3Nzk=,81,In object_detection_tutorial
3270,MDU6SXNzdWUyOTI2Njc5MzE=,78,Slow inference speed of object detection models and a hack as solution
6253,MDU6SXNzdWU0MTM1NDE2NTk=,77,LSTM Object Detection Model Does Not Run
1811,MDU6SXNzdWUyMzk0MTQ3MzU=,61,Run object_detection prediction on cloudML
3739,MDU6SXNzdWUzMDgzNDI4MjY=,60,deeplab doesn't predict correctly the segmentation masks
3366,MDU6SXNzdWUyOTYyOTEyNTg=,59,GPU is detected but training starts on the CPU
2930,MDU6SXNzdWUyNzgwMDg4MjA=,59,object_detection/protos/*.proto: No such file or directory
2267,MDU6SXNzdWUyNTE5MDAyNDg=,57,Object Detection API - Feature Request: YOLO and YOLOv2
5421,MDU6SXNzdWUzNjU3MTAzODg=,56,Multiple GPU in model_main.py (since there is no more train.py)
5003,MDU6SXNzdWUzNDc2NzE1OTE=,56,Key Conv/biases not found in checkpoint in Resnet 101
6423,MDU6SXNzdWU0MjQxOTc1NTE=,54,ObjectDetection API not suitable for tf 2.0.0-alpha0
3470,MDU6SXNzdWUzMDAzNTc5MjM=,53,Evaluation step for pets demo does not work in Google Cloud ML engine
1817,MDU6SXNzdWUyMzk1NzE1NTI=,50,Out Of Memory when training on Big Images
7640,MDU6SXNzdWU1MDUwNTA2MTU=,49, Invoking ptxas not supported on Windows
5020,MDU6SXNzdWUzNDgyMTc5NTk=,47,TFLite have not support SquaredDifference/TFLite_Detection_PostProcess?
3203,MDU6SXNzdWUyOTAxNzAyNzU=,47,No variables to save error using tensorflow object detection API
2773,MDU6SXNzdWUyNzMxNTQ5Mzc=,46,Boundary of detected objects is not visible or detection is failing.
902,MDU6SXNzdWUyMDA4MjczMzc=,46,Syntaxnet needs a tensorflow submodule update. 
4881,MDU6SXNzdWUzNDQwNjc0NDI=,45,"Training custom model crashes with ""ERROR:tensorflow:Model diverged with loss = NaN."""
2225,MDU6SXNzdWUyNTA1MjEyMzU=,45,Evaluation in Object Detection hanging
6173,MDU6SXNzdWU0MDgyMDg2MzA=,44,struct2depth training data prep request for documentation
2031,MDU6SXNzdWUyNDUyNjAxNTE=,44,No module named 'object_detection'
1842,MDU6SXNzdWUyNDAwOTEwNTU=,44,ImportError: No module named nets
4848,MDU6SXNzdWUzNDMwNTk3MDM=,43,Tensorflow Object Detection API using Faster RCNN on Android devices. 
3835,MDU6SXNzdWUzMTA0NDgyNzU=,43,[tensorrt] Failed Execution
1972,MDU6SXNzdWUyNDM0MDU0MDI=,43,[object detection feature request]: use multiple gpu for training
1754,MDU6SXNzdWUyMzgzMjUxNDM=,43,Error: maximum box coordinate value is too large 
5954,MDU6SXNzdWUzOTM4NTk5NDY=,42,SSD resnet50 fpn model not detecting at all.
1879,MDU6SXNzdWUyNDEwNDg4NDg=,41,Error quantizing nodes(transform_graph) in rfcn_resnet101_coco
1876,MDU6SXNzdWUyNDA5NjgzMDY=,41,API ObjectDetection size of  input images issues 
2778,MDU6SXNzdWUyNzMzMDQ2OTM=,40,Odd batch_size specific behaviour with nasnet_large on ImageNet validation
2648,MDU6SXNzdWUyNjk2MzEyNzI=,40,How to finetune the NasNet-A model for a different dataset ?
2194,MDU6SXNzdWUyNDk2MDY0MjE=,40,Corrupt JPEG data: 245 extraneous bytes before marker 0xd9
2739,MDU6SXNzdWUyNzIxNjU5Njg=,39,Error running training in google ML engine - No matplotlib.pyplot module
1836,MDU6SXNzdWUyNDAwNDA4MDY=,39,SSD MobileNet: Cannot finetune from checkpoint
3995,MDU6SXNzdWUzMTQ5NTE2NjI=,38,"got an unexpected keyword argument ""serialized_options"",  centos 7"
2653,MDU6SXNzdWUyNjk3OTYwNDA=,38,Train.py in object_detection crash. AttributeError: module 'tensorflow.contrib.slim.python.slim.data.tfexample_decoder' has no attribute 'BackupHandler'
4909,MDU6SXNzdWUzNDQ4MjUwNzY=,36,"ValueError: Tensor conversion requested dtype string for Tensor with dtype float32: 'Tensor(""arg0:0"", shape=(), dtype=float32, device=/device:CPU:0)'"
4783,MDU6SXNzdWUzNDE1NzYxODU=,36,Quantized SSD-MobileNet Checkpoints Missing Min/Max?
1854,MDU6SXNzdWUyNDA0OTg0NzE=,36,GPU memory error with train.py and eval.py running together
1696,MDU6SXNzdWUyMzcxNzAzMTY=,36,Error in run eval.py WARNING:root:The following classes have no ground truth examples: 0
373,MDU6SXNzdWUxNzQxMzQ0NTg=,36,textsum : How to train against my own data ?
8047,MDU6SXNzdWU1NTAyMTI2NDQ=,35,Using TensorFlow backend. ERROR:root:Internal Python error in the inspect module. Below is the traceback from this internal error.  ERROR:root:Internal Python error in the inspect module. Below is the traceback from this internal error.
7703,MDU6SXNzdWU1MTA1MDExMzM=,35,Object Detection with AttributeError: module 'tensorflow' has no attribute 'GraphDef' in TF 2.x
7165,MDU6SXNzdWU0NjUzMDAwMjU=,35,Questions about DELF model
4682,MDU6SXNzdWUzMzc3NTg3NDI=,35,Bounding box coordinates via video object detection
